{
  "schema_version": "1.0.0",
  "id": "wag-security-recognition",
  "organization": "Wag!",
  "recognition": {
    "kind": "hall_of_fame",
    "url": "https://wagwalking.com/responsible-disclosure",
    "summary": "First valid reports leading to a code or configuration change receive consent-based Hall credit.",
    "source_ids": [
      "policy"
    ]
  },
  "reporting": {
    "route": "direct_email",
    "url": "https://wagwalking.com/responsible-disclosure",
    "summary": "The policy publishes direct security email for responsible reports.",
    "source_ids": [
      "policy"
    ]
  },
  "rewards": {
    "status": "unknown",
    "summary": "Recognition uses leaderboard points; no monetary reward promise is stated.",
    "source_ids": [
      "policy"
    ]
  },
  "reviewed_at": "2026-10-12T18:18:04Z",
  "submission_availability": "not_tested",
  "limitations": [
    "Points are not currency. Participation eligibility, privacy protection and coordinated disclosure conditions apply."
  ],
  "sources": [
    {
      "id": "policy",
      "title": "Responsible disclosure and reporting policy",
      "url": "https://wagwalking.com/responsible-disclosure",
      "publisher": "Wag!",
      "retrieved_at": "2026-10-12T18:18:04Z",
      "provenance": "official_primary",
      "access_method": "text"
    }
  ],
  "content_scope": "first_party_recognition_and_reporting_reference",
  "rights": "Original summary CC BY 4.0; linked sources and trademarks retain their own rights."
}

