{
  "schema_version": "1.0.0",
  "id": "erasmus-university-security-recognition",
  "organization": "Erasmus University Rotterdam",
  "recognition": {
    "kind": "hall_of_fame",
    "url": "https://www.eur.nl/campus/locaties/campus-woudestein/beveiliging-veiligheid/informatiebeveiliging/hall-fame",
    "summary": "Responsible reporters can receive requested credit; the university maintains a populated Hall.",
    "source_ids": [
      "recognition",
      "policy"
    ]
  },
  "reporting": {
    "route": "direct_email",
    "url": "https://www.eur.nl/campus/locaties/campus-woudestein/beveiliging-veiligheid/informatiebeveiliging/responsible-disclosure",
    "summary": "The policy publishes direct CERT email and an optional university form.",
    "source_ids": [
      "policy"
    ]
  },
  "rewards": {
    "status": "unknown",
    "summary": "First previously unknown valid reports may receive appreciation ranging from honorable mention to a gift, not a guaranteed cash payout.",
    "source_ids": [
      "policy"
    ]
  },
  "reviewed_at": "2026-10-12T18:13:00Z",
  "submission_availability": "not_tested",
  "limitations": [
    "The policy is not an invitation to extensive active scanning. Independently controlled affiliated or hosted sites do not qualify for Hall credit under this policy."
  ],
  "sources": [
    {
      "id": "policy",
      "title": "Responsible disclosure and reporting policy",
      "url": "https://www.eur.nl/campus/locaties/campus-woudestein/beveiliging-veiligheid/informatiebeveiliging/responsible-disclosure",
      "publisher": "Erasmus University Rotterdam",
      "retrieved_at": "2026-10-12T18:13:00Z",
      "provenance": "official_primary",
      "access_method": "text"
    },
    {
      "id": "recognition",
      "title": "Public researcher recognition",
      "url": "https://www.eur.nl/campus/locaties/campus-woudestein/beveiliging-veiligheid/informatiebeveiliging/hall-fame",
      "publisher": "Erasmus University Rotterdam",
      "retrieved_at": "2026-10-12T18:13:00Z",
      "provenance": "official_primary",
      "access_method": "text"
    }
  ],
  "content_scope": "first_party_recognition_and_reporting_reference",
  "rights": "Original summary CC BY 4.0; linked sources and trademarks retain their own rights."
}

