{
  "schema_version": "1.0.0",
  "id": "philips-security-recognition",
  "organization": "Philips",
  "recognition": {
    "kind": "hall_of_fame",
    "url": "https://www.philips.com/a-w/security/coordinated-vulnerability-disclosure/hall-of-honors.html",
    "summary": "Hall of Honors recognition covers the first reporter of a new acknowledged vulnerability who cooperates and chooses public credit.",
    "source_ids": [
      "recognition",
      "policy"
    ]
  },
  "reporting": {
    "route": "direct_email",
    "url": "https://www.philips.com/a-w/security/coordinated-vulnerability-disclosure.html",
    "summary": "The disclosure policy documents direct email reporting and requests PGP encryption.",
    "source_ids": [
      "policy"
    ]
  },
  "rewards": {
    "status": "unknown",
    "summary": "The reviewed policy establishes recognition without promising a monetary award.",
    "source_ids": [
      "policy"
    ]
  },
  "reviewed_at": "2026-10-12T16:39:56Z",
  "submission_availability": "not_tested",
  "limitations": [
    "Testing products in active use, including patient-care equipment, is prohibited.",
    "Philips and Signify have separate disclosure routes; this entry concerns Philips."
  ],
  "sources": [
    {
      "id": "recognition",
      "title": "Coordinated vulnerability disclosure Hall of Honors",
      "url": "https://www.philips.com/a-w/security/coordinated-vulnerability-disclosure/hall-of-honors.html",
      "publisher": "Philips",
      "retrieved_at": "2026-10-12T16:39:56Z",
      "provenance": "official_primary",
      "access_method": "text"
    },
    {
      "id": "policy",
      "title": "Coordinated vulnerability disclosure statement",
      "url": "https://www.philips.com/a-w/security/coordinated-vulnerability-disclosure.html",
      "publisher": "Philips",
      "retrieved_at": "2026-10-12T16:39:56Z",
      "provenance": "official_primary",
      "access_method": "text"
    }
  ],
  "content_scope": "first_party_recognition_and_reporting_reference",
  "rights": "Original summary CC BY 4.0; linked sources and trademarks retain their own rights."
}
